{
  "$schema": "http://json-schema.org/draft-07/schema#",
  "$id": "https://raw.githubusercontent.com/tedburner/kapibala/main/schemas/settings.schema.json",
  "title": "Kapibala (kpbl) User Settings",
  "description": "Kapibala 配置文件契约，适用于 ~/.kapibala/settings.json（全局）与 ./.kapibala/settings.json（项目本地）。",
  "type": "object",
  "additionalProperties": false,
  "required": ["defaultModel", "profiles"],
  "properties": {
    "$schema": {
      "type": "string",
      "description": "本文件的 schema 地址，编辑器据此提供自动补全与校验。"
    },
    "defaultModel": {
      "type": "string",
      "description": "启动时默认使用的模型，取值必须是 profiles 中某个 id。"
    },
    "modelRouting": {
      "type": "object",
      "description": "显式场景模型绑定。planning/execution/fast 通过 /model route 或 --role 选择；summary 仅用于摘要，未绑定时回退 default。",
      "additionalProperties": false,
      "properties": {
        "planning": {
          "type": "string",
          "description": "规划/架构拆解场景使用的模型 id（调用次数少、更看重推理能力）。"
        },
        "execution": {
          "type": "string",
          "description": "工具循环执行场景使用的模型 id（更看重延迟与成本）。"
        },
        "summary": {
          "type": "string",
          "description": "上下文压缩与会话总结场景使用的模型 id。"
        },
        "fast": {
          "type": "string",
          "description": "用户显式选择的快速问答模型 id，不自动分类或切换角色。"
        }
      }
    },
    "profiles": {
      "type": "array",
      "description": "模型画像列表，每个条目绑定端点、密钥来源与协议特性。这里只需写用户自己关心或自建的模型：内置清单由程序侧提供，缺什么就用代码里的那份补什么，重复声明只会制造一份会过期的快照。",
      "items": { "$ref": "#/definitions/modelProfile" }
    },
    "skills": {
      "type": "object",
      "additionalProperties": false,
      "description": "技能默认开启。已信任项目只可关闭或增加禁用名称，不能解除全局限制。",
      "properties": {
        "enabled": { "type": "boolean", "default": true },
        "disabled": {
          "type": "array",
          "default": [],
          "items": { "type": "string", "maxLength": 64, "pattern": "^[a-z0-9]+(?:-[a-z0-9]+)*$" }
        }
      }
    },
    "trustedProjects": {
      "type": "array",
      "description": "已由用户永久信任的项目真实绝对路径。仅允许出现在全局配置中，项目级配置里的该字段会被忽略——否则任何仓库都能通过自行声明信任来绕过确认。",
      "items": { "type": "string" }
    },
    "builtinCatalogVersion": {
      "type": "integer",
      "minimum": 0,
      "description": "本配置所依据的内置模型清单版本，写入时由程序自动盖章，无需手改。启动时若发现落后于当前版本，会执行一次目录升级：重定向已退役的模型 id、同步过期的端点与上下文窗口、把密钥带到新档位。没有这个字段，配置就永远是首次写入那天的快照，厂商换代后菜单里会一直挂着已退役的模型。"
    }
  },
  "definitions": {
    "modelProfile": {
      "type": "object",
      "additionalProperties": false,
      "required": ["id", "name", "provider", "baseURL", "apiKeyEnv", "modelName"],
      "properties": {
        "id": {
          "type": "string",
          "description": "唯一标识，供 /model <id> 与 modelRouting 引用。"
        },
        "name": {
          "type": "string",
          "description": "交互界面中展示的友好名称。"
        },
        "provider": {
          "type": "string",
          "enum": ["openai-compatible", "anthropic", "openai-responses"],
          "description": "显式选择 Chat Completions、Anthropic Messages 或 OpenAI Responses；自建网关不根据模型名称自动迁移。"
        },
        "baseURL": {
          "type": "string",
          "description": "API 端点，例如 https://api.deepseek.com/v1"
        },
        "apiKeyEnv": {
          "type": "string",
          "description": "密钥所在的环境变量名；接入无需鉴权的本地服务时填 NONE。"
        },
        "apiKey": {
          "type": "string",
          "description": "内联密钥。不推荐：优先使用环境变量，避免凭据落入配置文件。同一厂商族的模型共用一份密钥——只需为其中任意一个填写，同族其余模型自动复用；更新密钥时会清理同族冗余副本，保证只保留一份。可识别厂商（DeepSeek / OpenAI / Anthropic / Google / 通义千问 / Kimi / 智谱 / Ollama）按厂商归组；自建端点按 host 隔离，不同网关不会串用密钥；绝不做跨厂商兜底。"
        },
        "modelName": {
          "type": "string",
          "description": "实际发给 API 的 model 参数。"
        },
        "contextWindow": {
          "oneOf": [
            {
              "type": "integer",
              "minimum": 1
            },
            {
              "type": "string",
              "pattern": "^(?:[0-9]+(?:\\.[0-9]{1,3})?[Kk]|[0-9]+(?:\\.[0-9]{1,6})?[Mm])$",
              "not": {
                "pattern": "^0+(?:\\.0+)?[KkMm]$"
              }
            }
          ],
          "default": "1M",
          "description": "上下文窗口 Token 数。支持正整数或十进制 K/M 简写（如 256K、1M、1.05M）；未配置时按 1M 估算。"
        },
        "supportsThinking": {
          "type": "boolean",
          "description": "是否解析 reasoning_content 为规范 thinking 块。"
        },
        "maxOutputTokens": {
          "type": "integer",
          "minimum": 1,
          "maximum": 9007199254740991,
          "description": "主任务含思考的总输出上限；内置 OpenAI 默认 32768、Claude 默认 16384、兼容模型默认 4096，用户更低覆盖会保留。摘要目的预算仍不超过 4096。"
        },
        "anthropicWorkspaceId": {
          "type": "string",
          "minLength": 1,
          "description": "可选 Anthropic 工作区 ID，仅原生 Messages 协议使用。"
        },
        "chatCapabilities": {
          "type": "object",
          "additionalProperties": false,
          "description": "Chat 端点显式能力；缺省维持既有参数基线，并要求合法 finish_reason 和 DONE。",
          "properties": {
            "maxTokensField": { "enum": ["max_tokens", "max_completion_tokens"] },
            "supportsStreamingUsage": { "type": "boolean" },
            "supportsTemperature": { "type": "boolean" },
            "requiresDone": { "type": "boolean" },
            "replayReasoningContent": { "type": "boolean" }
          }
        }
      }
    }
  }
}
